<?xml version="1.0" encoding="UTF-8" standalone="no"?>
<!-- El siguiente archivo XML está validado  con DTD y con XSD el elemnto raíz es "biblioteca"
y de la misma hay tres elementos principales : libros, revistas y periodicos-->

<!-- DTD -->
 <!-- <!DOCTYPE biblioteca SYSTEM "biblioteca.dtd">     -->

<!-- XSD -->
  <biblioteca xmlns:xsi="http://www.w3.org/2001/XMLSchema-instance" 
        	xsi:noNamespaceSchemaLocation= "biblioteca.xsd"> 

  <!-- <biblioteca>    -->
	<libros>
		<libro id="L1000" tipo_clase="novela" n_pag_libro="70">
			<titulo_libro>El expreso de Tokio</titulo_libro>
			<capitulos>
				<capitulo n_pag_cap="13">
					<titulo_capitulo>Los Testigos</titulo_capitulo>
					<contenido enlace="biblioteca/libros/novelas/elexpresodetokio/lostestigos"></contenido>
				</capitulo>
				<capitulo n_pag_cap="24">
					<titulo_capitulo>Un doble suicidio</titulo_capitulo>
					<contenido enlace="biblioteca/libros/novelas/elexpresodetokio/undoblesuicidio"></contenido>
				</capitulo>
				<capitulo n_pag_cap="16">
					<titulo_capitulo>Las dos estaciones de Kashii</titulo_capitulo>
					<contenido
						enlace="biblioteca/libros/novelas/elexpresodetokio/lasdosestacionesdekashii"></contenido>
				</capitulo>
				<capitulo n_pag_cap="17">
					<titulo_capitulo>Los pasajeros de Tokio</titulo_capitulo>
					<contenido
						enlace="biblioteca/libros/novelas/elexpresodetokio/lospasajerosdetokio"></contenido>
				</capitulo>

			</capitulos>

			<indice>Indice</indice>

			<sinopsis></sinopsis>
		</libro>

		<libro id="L2000" tipo_clase="infantil" n_pag_libro="15">
			<titulo_libro>Las aventuras de Pinocho</titulo_libro>
			<capitulos>

				<capitulo n_pag_cap="3">
					<titulo_capitulo>Capitulo I</titulo_capitulo>
					<contenido enlace="biblioteca/libros/infantil/lasaventurasdepinocho/capituloI"></contenido>
				</capitulo>
				<capitulo n_pag_cap="4">
					<titulo_capitulo>Capitulo II</titulo_capitulo>
					<contenido enlace="biblioteca/libros/infantil/lasaventurasdepinocho/capituloII"></contenido>
				</capitulo>
				<capitulo n_pag_cap="5">
					<titulo_capitulo>Capitulo III</titulo_capitulo>
					<contenido enlace="biblioteca/libros/infantil/lasaventurasdepinocho/capituloIII"></contenido>
				</capitulo>
				<capitulo n_pag_cap="6">
					<titulo_capitulo>Capitulo IV</titulo_capitulo>
					<contenido enlace="biblioteca/libros/infantil/lasaventurasdepinocho/capituloIV"></contenido>
				</capitulo>

			</capitulos>

			<indice>Indice</indice>

			<sinopsis></sinopsis>

		</libro>

		<libro id="L3000" tipo_clase="didactico" n_pag_libro="7">
			<titulo_libro>Breve ortografia escolar</titulo_libro>
			<capitulos>
				<capitulo n_pag_cap="2">
					<titulo_capitulo>Reglas generales</titulo_capitulo>
					<contenido enlace="biblioteca/libros/didactico/breveortografiaescolar/reglasgenerales"></contenido>
				</capitulo>
				<capitulo n_pag_cap="1">
					<titulo_capitulo>Reglas del acento</titulo_capitulo>
					<contenido enlace="biblioteca/libros/didactico/breveortografiaescolar/reglasdelacento"></contenido>
				</capitulo>
				<capitulo n_pag_cap="2">
					<titulo_capitulo>Reglas de la -b</titulo_capitulo>
					<contenido enlace="biblioteca/libros/didactico/breveortografiaescolar/reglasdela-b"></contenido>
				</capitulo>
				<capitulo n_pag_cap="2">
					<titulo_capitulo>Reglas de la -v</titulo_capitulo>
					<contenido enlace="biblioteca/libros/didactico/breveortografiaescolar/reglasdela-v"></contenido>
				</capitulo>

			</capitulos>

			<indice>Indice</indice>

			<sinopsis></sinopsis>

		</libro>
	</libros>


	<revistas>
		<revista id="R1000" tipo_clase="informatica" n_pag_revista="67">
			<titulo>Computer Hoy</titulo>
			<numero_revista>627</numero_revista>
			<indice_contenido>Contenido</indice_contenido>
			<secciones>
				<seccion n_pag_seccion="1">
					<contenido enlace="http//:revistainformatica.com"> </contenido>
				</seccion>
			</secciones>
		</revista>

		<revista id="R2000" tipo_clase="corazon" n_pag_revista="50">
			<titulo>Hola</titulo>
			<numero_revista>525</numero_revista>
			<indice_contenido>Contenido</indice_contenido>
			<secciones>
				<seccion n_pag_seccion="3">
					<contenido enlace="http//:revistacorazon.com"> </contenido>
				</seccion>
			</secciones>
		</revista>

		<revista id="R3000" tipo_clase="coches" n_pag_revista="50">
			<titulo>Turini</titulo>
			<numero_revista>26</numero_revista>
			<indice_contenido>Contenido</indice_contenido>
			<secciones>
				<seccion n_pag_seccion="4">
					<contenido enlace="http//:revistacoches.com"> </contenido>
				</seccion>
			</secciones>
		</revista>

		<revista id="R4000" tipo_clase="investigacion" n_pag_revista="80">
			<titulo>Nature</titulo>
			<numero_revista>733</numero_revista>
			<indice_contenido>Contenido</indice_contenido>
			<secciones>
				<seccion n_pag_seccion="6">
					<contenido enlace="http//:revistainvestigacion.com"> </contenido>
				</seccion>
			</secciones>
		</revista>

		<revista id="R5000" tipo_clase="otras" n_pag_revista="54">
			<titulo>Hogar</titulo>
			<numero_revista>125</numero_revista>
			<indice_contenido>Contenido</indice_contenido>
			<secciones>
				<seccion n_pag_seccion="4">
					<contenido enlace="http//:revistaotros.com"> </contenido>
				</seccion>
			</secciones>
		</revista>
	</revistas>


	<periodicos>
		<periodico id="P6000" tipo_clase="nacional" fecha_publicacion="2023-05-02">
			<secciones_periodico>
				<seccion_p tipo_seccion="economia">
					<articulo autor="Emilio Ontiveros"> </articulo>
				</seccion_p>
				<seccion_p tipo_seccion="opinion">
					<articulo autor="Juan Soto"> </articulo>
				</seccion_p>
				<seccion_p tipo_seccion="deportes">
					<articulo autor="Antonio Lobato"></articulo>
				</seccion_p>
				<seccion_p tipo_seccion="nacional">
					<articulo autor="José María Carrascal"></articulo>
				</seccion_p>
				<seccion_p tipo_seccion="internacional">
					<articulo autor=" Jordi Pérez "></articulo>
				</seccion_p>
			</secciones_periodico>

			<indice_p></indice_p>
			<contenido_p enlaces="http//:elperiodico.com"></contenido_p>

		</periodico>

		<periodico id="P7000" tipo_clase="internacional" fecha_publicacion="2022-10-01">
			<secciones_periodico>
				<seccion_p tipo_seccion="economia">
					<articulo autor="Warrent Buffet"></articulo>
				</seccion_p>

				<seccion_p tipo_seccion="opinion">
					<articulo autor="Thomas Friedman"></articulo>
				</seccion_p>

				<seccion_p tipo_seccion="deportes">
					<articulo autor="Tania Ganguli"></articulo>
				</seccion_p>

				<seccion_p tipo_seccion="nacional">
					<articulo autor="Linda Qiu"></articulo>
				</seccion_p>

				<seccion_p tipo_seccion="internacional">
					<articulo autor="Andrew Testa"></articulo>
				</seccion_p>
			</secciones_periodico>

			<indice_p></indice_p>
			<contenido_p enlaces="http//:elperiodico.com"></contenido_p>
		</periodico>

	</periodicos>

</biblioteca>